,post_caption,platform,create_time,label
1675,من قلب وادي سوف، مدينة الألف قبة وقبة، نعلن اليوم سطراً جديداً في قصة التحول الرقمي لبلادنا. لقد بلغنا عتبة 2.6 مليون مشترك في خدمة الألياف البصرية حتى المنزل. خطوة جديدة نابعة من التزامنا العميق بربط الوطن بأحدث ما وصلت إليه التكنولوجيا، لمنح كل بيت جزائري تجربة اتصال لا مثيل لها بتدفقات تصل حتى 1.5 جيغا.  #اتصالات_الجزائر #دائما_أقرب  #خدمة_الألياف_البصرية,tiktok,2025-10-06T19:20:21.000Z,1
1676,"من لؤلؤة الغرب الجزائري، تلمسان  نشارككم وصولنا لعتبة 2.5 مليون زبون موصول بخدمة الألياف البصرية حتى المنزل FTTH خطوة أخرى تقربنا من مساعينا لنوفر لكم أينما كنتم في ربوع بلادنا تجربة انترنت متميزة من خلال تكنولوجيا الألياف البصرية و بتدفقات جد عالية تصل إلى 1,5 جيغا  #اتصالات_الجزائر #دائما_أقرب",tiktok,2025-09-14T09:35:05.000Z,1
1677,"حاب تدخل مودم جديد لدارك ؟  👈🏻 إرفع سرعة التدفق ديالك عبر تطبيق My Idoom و خير الـ Débit لي يوالمك و منها إستفاد من #العرض_الترويجي لـ Idoom Fibre لي يتضمن تخفيض على سعر مودم الألياف البصرية 🤩 🔗جميع المعلومات متوفرة على موقعنا الإلكتروني : https://www.algerietelecom.dz/ar/page/augmentez-votre-debit-et-beneficiez-dun-modem-wi-fi-de-nouvelle-generation-a-tarif-preferentiel-p306 --- #إتصالات_الجزائر #دائما_اقرب #خدمة #الألياف_البصرية ",tiktok,2025-09-02T17:11:25.000Z,1
1678,"عرض Week-end Boost يخليك تعيش تجربة انترنت خيالية بتدفقات تصل حتى 1,5 جيغا ⚡👈🏻 اكتيفي الـ Boost خلال عطلة نهاية الأسبوع و كونكتي و العب بلا حدود 🤩 🔗 جميع المعلومات متوفرة على موقعنا : https://www.algerietelecom.dz/ar/particuliers/week-end-boost-prod227---#اتصالات_الجزائر #دائما_أقرب  #weekendboost",tiktok,2025-08-21T17:16:49.000Z,1
1679,من وهران الباهية، نشارك معكم بلوغ 2.4 مليون زبون موصول بخدمة الألياف البصرية حتى المنزل، في خطوة جديدة نحو تعميم الإنترنت عالي السرعة عبر الوطن  شهر بعد شهر… تغطية أوسع، تجربة أفضل، مستقبل أسرع #اتصالات_الجزائر #دائما_أقرب #خدمة_الألياف_البصرية,tiktok,2025-08-15T09:09:17.000Z,1