,post_caption,platform,create_time,label
1681,شهر بعد شهر رانا نواكبوا تطوير شبكة الألياف البصرية حتى المنزل  شهر بعد شهر ، عائلة ايدوم فيبر راهي غير تكبر معانا  اهدافنا ، طموحاتنا ومجهوداتنا راهي غير تزيد باش نقدمولكم الأفضل  اليوم، نعلنوا بكل فخر عن بلوغ 2.3 مليون زبون موصول بخدمة الألياف البصرية حتى المنزل  الرحلة مستمرة، والطموح دايما أكبر . #اتصالات_الجزائر #دائما_أقرب,tiktok,2025-07-14T17:14:39.000Z,1
1683,منذ البداية استثمرنا في مستقبل بلادنا و أبنائنا، و واكبنا كل التطورات و أحدث التكنولوجيات. اليوم بمناسبة عيد الإستقلال 🇩🇿 نعلن عن ربط 50% من زبائننا  المشتركين في خدمة الأنترنت الثابت بتكنولوجيا الألياف البصرية حتى المنزل. هذا التقدم يعكس التزامنا الدائم بخدمتكم، و يترجم ثقتكم التي نعتز بها إلى إنجازات أكبر. شكرا ليكم زبائننا ❤️ --- #اتصالات_الجزائر  #دائما_أقرب  #أنترنت_الألياف_البصرية #FTTH  #IDOOMFIBRE  #عيد_الاستقلال,tiktok,2025-07-05T11:02:31.000Z,1
1684,في إطار التزامها بالبيئة والمجتمع، تطلق اتصالات الجزائر حملتها الصيفية لتنظيف الشواطئ  مبادرة تطوعية يشارك فيها عمال اتصالات الجزائر بكل حماس، لإحداث فرق حقيقي على الميدان   موعدنا نهار 28 جوان في عدة ولايات من الوطن 💪🏻 خطوة صغيرة...أثر كبير #صيّف_في_النقا #اتصالات_الجزائر #دائما_اقرب,tiktok,2025-06-27T20:36:20.000Z,1
1685,نفتخر بتحقيق إنجاز جديد في رحلتنا لتوسيع شبكة الألياف البصرية حتى المنازل على مستوى كامل التراب الوطني، حيث تم تسجيل المشترك رقم 2.2 مليون اليوم في ولاية #تمنراست. هذا الرقم يعكس التزامنا الثابت بتوفير حلول تكنولوجية حديثة، وتحسين تجربة الزبون من خلال خدمات إنترنت ذات سرعة وجودة عالية.  #اتصالات_الجزائر #دائما_أقرب #الألياف_البصرية,tiktok,2025-06-19T16:24:15.000Z,1
1686,بمناسبة اليوم العالمي للتبرع بالدم الموافق لـ 14 جوان، عمال اتصالات الجزائر في مبادرة تضامنية و انسانية للتبرع بالدم من تنظيم المؤسسة بالتعاون مع الوكالة الوطنية للدم (ANS)🩸   #لنمنح_جرعة_أمل  #اليوم_العالمي_للتبرع_بالدم #اتصالات_الجزائر,tiktok,2025-06-14T17:05:15.000Z,1