,post_caption,platform,create_time,label
1626,"اول مرة في الجزائر 🍊🌾 ياغورت جنينة فواكه و حبوب ",tiktok,2025-03-02T13:58:40.000Z,1
1628,ياغورت جنينة الذي يجمع بين بنة الفواكه و فوائد الحبوب 🥝🍎,tiktok,2025-02-27T15:57:03.000Z,1
1632,"! أول مرة في الجزائر   🌾🥝ياغورت جنيّنة فواكه و حبوب ",tiktok,2025-02-19T18:04:48.000Z,1
1633,"! أول مرة في الجزائر  صومام جابلنا الجديد ياغورت جنيّنة فواكه و حبوب  مزيج من الفواكه والحبوب. 🥭🌾 ! حبوب صغيرة لفايدة كبيرة 🌾🥭 #healthy #healthyfood #produitlaitier #gourmet #lait #graines #bienetre #yaourt ",tiktok,2025-02-17T07:46:32.000Z,1
1648,بمناسبة شهر أكتوبر الوردي، نظّمت اتصالات الجزائر رحلة مشي توعوية إلى غابة شنوة بولاية تيبازة، بمشاركة مجموعة من موظفات المؤسسة. تهدف هذه المبادرة إلى تعزيز الوعي بين موظفيها حول سرطان الثدي وأهمية الكشف المبكر كوسيلة فعّالة للوقاية والعلاج. تؤكد اتصالات الجزائر من خلال هذه المبادرة تضامنها مع كل النساء في مسيرة التحدي والأمل. 💗 #اتصالات_الجزائر #أكتوبر_الوردي #الفحص_المبكر #التوعية_الصحية,tiktok,2025-10-24T19:04:55.000Z,1
1656,كل يوم نقترب أكثر من تحقيق رؤيتنا باش نوصلوا تكنولوجية الألياف البصرية لكامل مناطق الوطن. بفضل جهود فرقنا الميدانية و التقنية، تتوسع تغطية الألياف البصرية حتى المنازل (FTTH) لتشمل المزيد من الأحياء والمناطق عبر الوطن. اليوم، يسر اتصالات الجزائر الإعلان عن بلوغ  عتبة 2.7 مليون مشترك موصول بخدمة الألياف البصرية Idoom Fibre !  كل يوم… نربط أكثر، نقرّب أكثر، ونبني معا المستقبل الرقمي لوطننا. #اتصالات_الجزائر #دائما_أقرب #الألياف_البصرية,tiktok,2025-10-23T20:16:17.000Z,1